id,codigo,marca,nombre,precio,categoria
394,101004,VARIOS,PRESTOPRONTA POLENTA X490G,885.0,HARINAS
15350,113352,PRECIOS JUSTOS,PUREZA HARINA 000 U/FINA X1KG,790.0,HARINAS
2014,113259,PRECIOS JUSTOS,PUREZA HARINA C/LEV.ESP.P/PIZZA X1KG,1295.0,HARINAS
2094,113574,MOLINO CAÑUELAS S.A.,PUREZA HARINA LEUD.U/REF.X1KG,1150.0,HARINAS
756,103097,MOLINO CAÑUELAS S.A.,PUREZA HARINA ULTRA REF.0000 X1KG,965.0,HARINAS
1924,112815,MOLINOS RIO DE LA PL,VITINA SEMOLA PLUS X250G,1150.0,HARINAS
1923,112814,MOLINOS RIO DE LA PL,VITINA SEMOLA PLUS X500G,2085.0,HARINAS
822,103507,INVENTARIABLES,HELLMANNS KETCHUP D/P 250GR,1136.0,KETCHUP
3693,113367,EL ABASTECEDOR,NATURA KETCHUP D/P X250G,765.0,KETCHUP
1042,106382,CAREAGA HNOS Y TEGLI,LA ABADIA ARVEJAS PARTIDAS 400G,950.0,LEGUMBRES SECAS
1038,106378,INVENTARIABLES,LA ABADIA GARBANZOS X400G,1375.0,LEGUMBRES SECAS
1039,106379,CAREAGA HNOS Y TEGLI,LA ABADIA LENTEJAS X400G,1080.0,LEGUMBRES SECAS
1353,109826,CAREAGA HNOS Y TEGLI,LA ABADIA LENTEJON X400G,1460.0,LEGUMBRES SECAS
1040,106380,CAREAGA HNOS Y TEGLI,LA ABADIA MAIZ PISADO BCO. 400G,1195.0,LEGUMBRES SECAS
1041,106381,CAREAGA HNOS Y TEGLI,LA ABADIA MAIZ PISINGALLO 400G,790.0,LEGUMBRES SECAS
1044,106384,CAREAGA HNOS Y TEGLI,LA ABADIA POROTOS ALUBIAS 400G,1675.0,LEGUMBRES SECAS
1354,109827,CAREAGA HNOS Y TEGLI,LA ABADIA POROTOS COLORADO 500G,2155.0,LEGUMBRES SECAS
398,101034,UNILEVER DE ARGENTIN,HELLMANNS MAYONESA D/P X237G,739.0,MAYONESA
3544,101035,EL ABASTECEDOR,HELLMANNS MAYONESA D/P X475G,1321.0,MAYONESA
7505,108984,UNILEVER DE ARG.(FOO,HELLMANNS MAYONESA D/P X950G,2309.0,MAYONESA
766,103153,EL ABASTECEDOR,HELLMANNS MAYONESA LIVIANA DP 475G,1260.0,MAYONESA
3547,103487,UNILEVER DE ARGENTIN,HELLMANNS MAYONESA LIVIANA X237G,756.0,MAYONESA
9664,101038,UNILEVER DE ARGENTIN,HELLMANNS MAYONESA T/CAS DP X455G,1962.0,MAYONESA
10384,109488,NIZA S.A.,MAYOLIVA MAYO.SACHET X125G,619.0,MAYONESA
4373,111448,NIZA S.A.,MAYOLIVA MAYONESA  D/P X250G,1205.0,MAYONESA
10386,112934,NIZA S.A.,MAYOLIVA MAYONESA D/P X500CC,2339.0,MAYONESA
401,101047,EL ABASTECEDOR,NATURA MAYONESA D/P X250G,645.0,MAYONESA
402,101050,EL ABASTECEDOR,NATURA MAYONESA D/P X500G,1200.0,MAYONESA
400,101046,NIZA S.A.,NATURA MAYONESA SACHET X125G,335.0,MAYONESA
407,101064,ARCOR (SECOS),ARCOR MERM CIRUELA X454G,1899.0,MERMELADA
410,101067,INVENTARIABLES,ARCOR MERM DZNO DIET X390G,1899.0,MERMELADA
409,101066,ARCOR (SECOS),ARCOR MERM DZNO X454G,1899.0,MERMELADA
411,101068,"ARCOR (GOLOSINAS, CH",ARCOR MERM FRUT DIET X390G,2748.0,MERMELADA
412,101069,DULCIORA S.A.,ARCOR MERM FRUT X454G,1899.0,MERMELADA
414,101090,LA CAMPAGNOLA S.A.C.,BC LA CAMPAGNOLA MERM ARAND X390G,3188.0,MERMELADA
415,101091,ARCOR (SECOS),BC LA CAMPAGNOLA MERM CIRUE X390G,2545.0,MERMELADA
418,101095,INVENTARIABLES,BC LA CAMPAGNOLA MERM FRUT X390G,3188.0,MERMELADA
419,101096,ARCOR (SECOS),BC LA CAMPAGNOLA MERM NJA X390G,2545.0,MERMELADA
420,101098,LA CAMPAGNOLA S.A.C.,LA CAMPAGNOLA MERM ARAND X454G,2960.0,MERMELADA
422,101101,ARCOR (SECOS),LA CAMPAGNOLA MERM DZNO X454G,2395.0,MERMELADA
424,101103,LA CAMPAGNOLA S.A.C.,LA CAMPAGNOLA MERM FRUT X454G,2968.0,MERMELADA
2042,113368,NIZA S.A.,NATURA MOSTAZA D/P X250G,656.0,MOSTAZA
937,104724,UNILEVER DE ARG.(FOO,SAVORA MOSTAZA D/P  250G,709.0,MOSTAZA
3543,100154,UNILEVER DE ARGENTIN,SAVORA MOSTAZA SACHET  X 60 GR,329.0,MOSTAZA
7220,105445,PRECIOS JUSTOS,MAMA COCINA REBOZADOR P/FREIR X500G,1060.0,PAN RALLADO
2052,113385,MOLINOS RIO DE LA PL,PREFERIDO PAN RALLADO FIBRAX500,1149.0,PAN RALLADO
426,101138,EL ABASTECEDOR,PREFERIDO PAN RALLADO X1KG,2175.0,PAN RALLADO
2053,113386,EL ABASTECEDOR,PREFERIDO REBOZADOR FIBRA X500G,1149.0,PAN RALLADO
427,101141,MOLINOS RIO DE LA PL,PREFERIDO REBOZADOR X1KG,2175.0,PAN RALLADO
719,102765,RICOTONA S.A.,ROSA BCA PAN RALLADO X1KG,2110.0,PAN RALLADO
428,101143,RICOTONA S.A.,ROSA BCA PAN RALLADO X500G,1090.0,PAN RALLADO
429,101144,RICOTONA S.A.,ROSA BCA REBOZADOR X 1KG,2110.0,PAN RALLADO
430,101145,RICOTONA S.A.,ROSA BCA REBOZADOR X 500G,1090.0,PAN RALLADO
358,100878,FIDEGROUP S.A.,308 FIDEO NIDO N*1 HUEVO X500G,1475.0,PASTAS SECAS
359,100879,FIDEGROUP S.A.,308 FIDEO NIDO N*2 HUEVO X500G,1475.0,PASTAS SECAS
360,100880,FIDEGROUP S.A.,308 FIDEO NIDO N*3 HUEVO X500G,1475.0,PASTAS SECAS
8358,100883,MOLINOS RIO DE LA PL,DON VICENTE FETTUCCINI X500G,1595.0,PASTAS SECAS
362,100886,INVENTARIABLES,DON VICENTE FIDEO CASERITO X500G,1595.0,PASTAS SECAS
5909,100884,MOLINOS RIO DE LA PL,DON VICENTE FIDEO MOÑO X500G,2089.0,PASTAS SECAS
5910,100885,MOLINOS RIO DE LA PL,DON VICENTE FIDEO TIRABUZON X500G,1595.0,PASTAS SECAS
361,100882,INVENTARIABLES,DON VICENTE TALLARIN X500G,1595.0,PASTAS SECAS
365,100889,LA VIRGINIA,GIACOMO CAPELLETINI CARNE X500G,2650.0,PASTAS SECAS
363,100887,LA VIRGINIA,GIACOMO CAPELLETINI J/Q X500G,2650.0,PASTAS SECAS
364,100888,LA VIRGINIA,GIACOMO CAPELLETINI VERD X500G,2650.0,PASTAS SECAS
367,100895,LUCCHETTI,LUCCHETTI CODITO X500G,1135.0,PASTAS SECAS
369,100897,LUCCHETTI,LUCCHETTI MOÑO X500G,1925.0,PASTAS SECAS
368,100896,LUCCHETTI,LUCCHETTI MOSTACHOL X500G,1135.0,PASTAS SECAS
10679,100894,MOLINOS RIO DE LA PL,LUCCHETTI NIDO FETUCCINI X500G,1925.0,PASTAS SECAS
372,100900,INVENTARIABLES,LUCCHETTI SPAGUETTI X500G,1135.0,PASTAS SECAS
373,100901,MOLINOS RIO DE LA PL,LUCCHETTI TALLARIN X500G,1135.0,PASTAS SECAS
370,100898,INVENTARIABLES,LUCCHETTI TIRABUZON X500G,1135.0,PASTAS SECAS
15007,112833,MOLINOS RIO DE LA PL,LUCCHETTINIS ESP/QUESO X500GR,2529.0,PASTAS SECAS
10653,112832,MOLINOS RIO DE LA PL,LUCCHETTINIS J/QUESO X500GR,2529.0,PASTAS SECAS
1199,108551,MOLINOS RIO DE LA PL,MATARAZZO FIDEOS AVE MARIAX500G,1225.0,PASTAS SECAS
1326,109586,EL ABASTECEDOR,MATARAZZO FIDEOS CODIT.RAYA.X500G,1225.0,PASTAS SECAS
1198,108550,INVENTARIABLES,MATARAZZO FIDEOS DEDALITOX500G,1225.0,PASTAS SECAS
1328,109588,MOLINOS RIO DE LA PL,MATARAZZO FIDEOS MOñO MED.X500,2115.0,PASTAS SECAS
1197,108548,INVENTARIABLES,MATARAZZO FIDEOS MOSTACHOLX500G,1225.0,PASTAS SECAS
1327,109587,MOLINOS RIO DE LA PL,MATARAZZO FIDEOS PENNE RIG.X500,1110.0,PASTAS SECAS
1031,106297,EL ABASTECEDOR,MATARAZZO FIDEOS SPAGHETTI X 500G,1225.0,PASTAS SECAS
1032,106298,MOLINOS RIO DE LA PL,MATARAZZO FIDEOS TALLARIN X500G,1225.0,PASTAS SECAS
1034,106339,MOLINOS RIO DE LA PL,MATARAZZO FIDEOS TIRABUZON X500G,1225.0,PASTAS SECAS
7672,110059,MOLINOS RIO DE LA PL,MATARAZZO LASAGNA X 250GRS,1235.0,PASTAS SECAS
10470,109590,MOLINOS RIO DE LA PL,MATARAZZO MOSTACHOL 3 VEG.X500,1120.0,PASTAS SECAS
2078,113488,MOLTO S.A,MOLTO FIDEOS FORATTI  500G,969.0,PASTAS SECAS
2046,113375,MOLTO S.A,MOLTO FIDEOS MOSTACHOLES 500G,969.0,PASTAS SECAS
2047,113376,MOLTO S.A,MOLTO FIDEOS SPAGHETTI 500G,969.0,PASTAS SECAS
6910,113489,VARIOS,MOLTO FIDEOS TALLARIN 500G,969.0,PASTAS SECAS
1135,107940,MOLINOS RIO DE LA PL,EXQUISITA FLAN DUL/LECHE X40G,725.0,POSTRES POLVO
1134,107938,INVENTARIABLES,EXQUISITA FLAN VAINILLA X40G,725.0,POSTRES POLVO
1099,107281,MOLINOS RIO DE LA PL,EXQUISITA POSTRE LIGHT DDL X60G,865.0,POSTRES POLVO
1136,107941,INVENTARIABLES,EXQUISITA POSTRE VAINILLA X80GR,815.0,POSTRES POLVO
1890,112684,KRAFT FOODS (TERRABU,ROYAL FLAN VAIN.LIGHT X16GR,625.0,POSTRES POLVO
1888,112682,INVENTARIABLES,ROYAL FLAN VAINILLA X60GR,490.0,POSTRES POLVO
6223,100937,EL ABASTECEDOR,ROYAL MOUSSE CHOCO X65G,1165.0,POSTRES POLVO
1501,110836,PRECIOS JUSTOS,ROYAL POSTRE CHOCOLATE X50G,750.0,POSTRES POLVO
1503,110839,KRAFT FOODS (TERRABU,ROYAL POSTRE FRUTILLA X75G,750.0,POSTRES POLVO
1665,111701,NESTLE ARGENTINA (SE,MAGGI PURE DE PAPAS X200G,2350.0,PURE INSTANTANEO
325,100765,"ARCOR (GOLOSINAS, CH",AGUILA BAÑO REPOSTERIA BCO X150GR,2494.0,REPOSTERIA VARIOS
326,100766,"ARCOR (GOLOSINAS, CH",AGUILA BAÑO REPOSTERIA LECHE X150GR,2269.0,REPOSTERIA VARIOS
8646,100764,"ARCOR (GOLOSINAS, CH",AGUILA BAÑO REPOSTERIA S/AMARGO X150GR,2269.0,REPOSTERIA VARIOS
10668,100769,"ARCOR (GOLOSINAS, CH",AGUILA CHOCOLATE NEGRO X150GR,3150.0,REPOSTERIA VARIOS
6943,113454,ARCOR (SECOS),AGUILA CHOCOLITOS GOTA X150GR,3190.0,REPOSTERIA VARIOS
346,100855,LA VIRGINIA,ALICANTE CANELA MOLIDA X25G,1075.0,REPOSTERIA VARIOS
8882,110260,LA VIRGINIA,ALICANTE CANELA RAMA X20G,1840.0,REPOSTERIA VARIOS
351,100862,PRECIOS JUSTOS,ALICANTE EXTR VAINILLA X100CC,1230.0,REPOSTERIA VARIOS
2072,113452,ARCOR (SECOS),BON O BON RELLENO UNTABLE X290G,3690.0,REPOSTERIA VARIOS
894,104128,COMPANIA INTRODUCTOR,DOS ANCLAS AZUCAR IMPALP.X250G/300G,3315.0,REPOSTERIA VARIOS
893,104127,COMPANIA INTRODUCTOR,DOS ANCLAS AZUCAR NEGRA X250G,2679.0,REPOSTERIA VARIOS
895,104129,COMPANIA INTRODUCTOR,DOS ANCLAS ESENCIA VAINILLA X100CC,1759.0,REPOSTERIA VARIOS
4169,100617,KRAFT FOODS (TERRABU,ROYAL POLVO HORNEAR X50G,820.0,REPOSTERIA VARIOS
8643,101202,PRECIOS JUSTOS,CELUSAL SAL E/FINA PAQ.X1KG,1625.0,SALES
438,101205,PRECIOS JUSTOS,CELUSAL SAL FINA ESTUCHE X500G,1099.0,SALES
439,101206,PRECIOS JUSTOS,CELUSAL SAL FINA PAQUETE X500G,1079.0,SALES
4884,101203,PRECIOS JUSTOS,CELUSAL SAL GRUESA CAJA X1KG,1609.0,SALES
6566,101204,PRECIOS JUSTOS,CELUSAL SAL GRUESA PAQ.X1KG,1530.0,SALES
6567,101208,INDUSTRIAS QUIMICAS,CELUSAL SALERO FINA X100G,1600.0,SALES
4885,101210,INDUSTRIAS QUIMICAS,CELUSAL SALERO FINA X500G,3235.0,SALES
4886,101212,INDUSTRIAS QUIMICAS,CELUSAL SALERO LIGHT X235G,5289.3,SALES
440,101213,PRECIOS JUSTOS,DOS ANCLAS SAL FINA EST.X500G,1099.0,SALES
10483,104710,PRECIOS JUSTOS,DOS ANCLAS SAL FINA PAQ.X500G,949.0,SALES
805,103426,PRECIOS JUSTOS,DOS ANCLAS SAL GRUESA ESTX500G,575.0,SALES
806,103427,PRECIOS JUSTOS,DOS ANCLAS SAL PARRILL.EST500G,1175.0,SALES
442,101223,COMPANIA INTRODUCTOR,DOS ANCLAS SAL SALERO MESA X500G,2429.0,SALES
441,101218,COMPANIA INTRODUCTOR,DOS ANCLAS SALERO LIGHT X250GR,4215.0,SALES
821,103506,EL ABASTECEDOR,HELLMANNS SALSA GOLF D/P 250G,1194.0,SALSA GOLF
1127,107807,LA VIRGINIA,ALICANTE SALSA 4 QUESOS X37G,1490.0,SALSAS
357,100869,LA VIRGINIA,ALICANTE SALSA BLANCA X40G,1140.0,SALSAS
1816,112330,ARCOR (SECOS),ARCOR SALSA PIZZA D/PACK X340GR,609.0,SALSAS
880,104029,VARIOS,KNORR SALSA FILETTO D/P X 340G,863.0,SALSAS
879,104027,UNILEVER DE ARGENTIN,KNORR SALSA PIZZA D/P X340G,863.0,SALSAS
878,104026,INVENTARIABLES,KNORR SALSA POMA.D/P X340,863.0,SALSAS
882,104031,UNILEVER DE ARGENTIN,KNORR SALSA PORT.D/PX340,329.0,SALSAS
1966,113096,ARCOR (SECOS),SALSATI SALSA PIZZA X340GR,669.0,SALSAS
7617,113130,ARCOR (SECOS),SALSATI SALSA POMAROLA D/P X340GR,669.0,SALSAS
1287,109331,INVENTARIABLES,3D MEGA SNACKS QUESO X 92GRS.,2020.0,SNACKS
1290,109342,INVENTARIABLES,CHEETOS SNACKS SUPER QUESO 151G.,3320.0,SNACKS
8608,109330,INVENTARIABLES,DORITOS SNACKS SAB.QUESO 77G.,2000.0,SNACKS
8060,111817,INVENTARIABLES,KRACHITOS MANI PELADO 120 GR,1335.0,SNACKS
1691,111815,INVENTARIABLES,KRACHITOS PALITOS SALADOS 110 G,829.0,SNACKS
2073,113458,INVENTARIABLES,KRACHITOS PAPA FRITAS C/AMER.115G,1399.0,SNACKS
1689,111813,INVENTARIABLES,KRACHITOS PAPAS FRITAS 115GR,1399.0,SNACKS
1690,111814,INVENTARIABLES,KRACHITOS PAPAS FRITAS 420 GR,4850.0,SNACKS
2137,113748,INVENTARIABLES,KRACHITOS PAPAS FRITAS C/AMER.420GG,4849.0,SNACKS
1489,110662,INVENTARIABLES,LAYS SNACKS PAPAS CLASICAS 134GR,3300.0,SNACKS
5256,111077,INVENTARIABLES,LAYS SNACKS PAPAS CLASICAS 45GR.,1210.0,SNACKS
1512,110892,INVENTARIABLES,LAYS SNACKS PAPAS FRITAS CLAS 94G,2010.0,SNACKS
1169,108302,PEPSICO DE ARGENTINA,LAYS SNACKS PAPAS JAM/SERR.77G,2010.0,SNACKS
7900,109410,INVENTARIABLES,LAYS SNACKS PAPAS QUESO /CEB.77G,2010.0,SNACKS
2097,113581,CEREALKO S.A.,MACRITAS SNACKS NACHOS ORIG.X250GR,2599.0,SNACKS
2057,113397,INVENTARIABLES,MANITOON MANI CROCANTE CLAS.160G,1395.0,SNACKS
2059,113399,INVENTARIABLES,MANITOON MANI CROCANTE PIZZA 160G,1395.0,SNACKS
2058,113398,INVENTARIABLES,MANITOON MANI CROCANTE QU.160G,1395.0,SNACKS
1103,107381,INVENTARIABLES,PEHUAMAR SNACKS MANI  PELADO X135G,2330.0,SNACKS
1104,107382,PRECIOS JUSTOS,PEHUAMAR SNACKS MANI PELADO 85G,1530.0,SNACKS
1305,109438,PRECIOS JUSTOS,PEHUAMAR SNACKS PALITO QUESO 90G,1510.0,SNACKS
7898,100754,INVENTARIABLES,PEHUAMAR SNACKS PALITOS SAL.165G,2060.0,SNACKS
3724,113926,PRECIOS JUSTOS,PEHUAMAR SNACKS PALITOS SAL.90G,1500.0,SNACKS
2225,114165,INVENTARIABLES,PRINGLES SNACKS PAPAS ORIG.X 124GR,3419.0,SNACKS
448,101244,UNILEVER DE ARGENTIN,KNORR QUICK SOPA CHOCLO X5 SOB,1437.0,SOPAS
17963,112499,INVENTARIABLES,KNORR QUICK SOPA VEGETALES X59.5GR,1437.0,SOPAS
444,101239,PRECIOS JUSTOS,KNORR SOPA CREMA CEBOLLA X65G,995.0,SOPAS
447,101243,INVENTARIABLES,KNORR SOPA CREMA ZAPALLO X70G,995.0,SOPAS
8436,108445,UNILEVER DE ARGENTIN,KNORR SOPA POLLO/C.ANGEL 105GR,982.0,SOPAS
2228,114175,CACHAY S.A,CACHAMAI TE AMARILLA X20 SAQ.,939.0,TE Y MATE COCIDO
1950,113018,CACHAY S.A,CACHAMAI TE BOLDO X20SAQ,1280.0,TE Y MATE COCIDO
454,101271,INVENTARIABLES,GREEN HILLS TE X25U,970.0,TE Y MATE COCIDO
455,101272,INVENTARIABLES,GREEN HILLS TE X50U,1845.0,TE Y MATE COCIDO
8152,112554,LA VIRGINIA,LA MORENITA 1890 TE SAQ X50U,1290.0,TE Y MATE COCIDO
1972,113115,LA VIRGINIA,LA MORENITA TE CLAS.RAP.INF. X25 S.,645.0,TE Y MATE COCIDO
483,101395,J. LLORENTE Y CIA. S,LA TRANQUERA MATE COCIDO SAQ.X25U,675.0,TE Y MATE COCIDO
456,101276,LA VIRGINIA,LA VIRGINIA TE BOLDO X25U,1490.0,TE Y MATE COCIDO
457,101277,LA VIRGINIA,LA VIRGINIA TE C/LIMON X20U,1350.0,TE Y MATE COCIDO
716,102758,LA VIRGINIA,LA VIRGINIA TE FRUTILLA X20U,1390.0,TE Y MATE COCIDO
960,104993,LA VIRGINIA,LA VIRGINIA TE MANZ/ANIS MC X25U,1490.0,TE Y MATE COCIDO
458,101280,LA VIRGINIA,LA VIRGINIA TE MANZANILLA X25U,1099.0,TE Y MATE COCIDO
459,101281,LA VIRGINIA,LA VIRGINIA TE MEZ-HIERBASX25U,1310.0,TE Y MATE COCIDO
1118,107580,LA VIRGINIA,LA VIRGINIA TE TIL/MAN/CEDX25U,1470.0,TE Y MATE COCIDO
460,101284,LA VIRGINIA,LA VIRGINIA TE TILO X25U,2095.0,TE Y MATE COCIDO
1511,110885,LA VIRGINIA,LA VIRGINIA TE X25SAQ,620.0,TE Y MATE COCIDO
837,103686,VARIOS,TARAGUI MATE COCIDO SAQ.S/E.X25U,912.0,TE Y MATE COCIDO
8145,105256,VARIOS,TARAGUI NIñOS YERBA SAQ.X20U,1673.0,TE Y MATE COCIDO
999,105688,PRECIOS JUSTOS,TARAGUI SILVESTRE TE BOLDO X25U,1472.0,TE Y MATE COCIDO
10567,101291,ES.LAS MARIAS SACIFA,TARAGUI SILVESTRE TE MANZ.X25U,1215.0,TE Y MATE COCIDO
8144,103607,INVENTARIABLES,TARAGUI SILVESTRE TE MEZC.X10U,593.0,TE Y MATE COCIDO
1000,105689,ES.LAS MARIAS SACIFA,TARAGUI SILVESTRE TE MEZC.X25U,1334.0,TE Y MATE COCIDO
462,101292,ESTAB.LAS MARIAS (AP,TARAGUI SILVESTRE TE TILO X25U,1965.0,TE Y MATE COCIDO
1807,112299,VARIOS,TARAGUI TE ENS.PLAC.FR.ROJAS X20S,1508.0,TE Y MATE COCIDO
3914,112294,ES.LAS MARIAS SACIFA,TARAGUI TE ENS.PLAC.MZ/CAN/MX20,1508.0,TE Y MATE COCIDO
1861,112543,INVENTARIABLES,TARAGUI TE HEBRAS BLEND ESP.X180GR,2605.0,TE Y MATE COCIDO
1594,111296,ESTAB.LAS MARIAS (AP,TARAGUI TE S/ENSOB.X100,2510.0,TE Y MATE COCIDO
803,103422,VARIOS,TARAGUI TE S/ENSOB.X25U,669.0,TE Y MATE COCIDO
8312,103423,VARIOS,TARAGUI TE S/ENSOB.X50U,1280.0,TE Y MATE COCIDO
896,104145,PRECIOS JUSTOS,TARAGUI TE VERDE X20U,1303.0,TE Y MATE COCIDO
909,104354,VARIOS,UNION MATE COCIDO SAQ.S/E.X25U,735.0,TE Y MATE COCIDO
969,105243,VARIOS,UNION MATE COCIDO SAQ.S/E.X50U,1642.0,TE Y MATE COCIDO
434,101161,PRECIOS JUSTOS,ARCOR TOMATE PURE T/B X 520G,639.0,PURE DE TOMATE
6912,113925,R.P.B  S.A.,DE LA HUERTA PURE TOMATE X1030G,1599.0,PURE DE TOMATE
5741,113281,R.P.B  S.A.,DE LA HUERTA PURE TOMATE X530G,789.0,PURE DE TOMATE
10237,100780,ALIMENTOS PREMIUN S.,INCA EXTRACTO DE TOMATE X150GR,765.0,PURE DE TOMATE
7210,101165,LA CAMPAGNOLA S.A.C.,LA CAMPAGNOLA TOM PULPA T/B X520GR,635.0,PURE DE TOMATE
437,101168,INVENTARIABLES,MOLTO TOMATE PURE T/B X520G,720.0,PURE DE TOMATE
463,101299,FRUTOS DE CUYO S.A.,SALSATI TOM PERITA C/PURE X400GR,1123.0,PURE DE TOMATE
998,105670,VARIOS,SALSATI TOMATE PURE T/B X520G,765.0,PURE DE TOMATE
18235,110048,MOLINOS RIO DE LA PL,COCINERO ACETO BALSAMICO X250CC,1615.0,VINAGRE /ACETO / JUGO DE LIMON
1896,112706,INVENTARIABLES,DOS ANCLAS ACETO BALSAMICO X250CC,2325.0,VINAGRE /ACETO / JUGO DE LIMON
987,105515,COMPANIA INTRODUCTOR,DOS ANCLAS VINAG.VINO PET X1L,2979.0,VINAGRE /ACETO / JUGO DE LIMON
986,105514,COMPANIA INTRODUCTOR,DOS ANCLAS VINAGRE ALCOH.PETX1L,1969.0,VINAGRE /ACETO / JUGO DE LIMON
933,104685,COMPANIA INTRODUCTOR,DOS ANCLAS VINAGRE ALCOH.PETX500CC,1130.0,VINAGRE /ACETO / JUGO DE LIMON
988,105516,COMPANIA INTRODUCTOR,DOS ANCLAS VINAGRE MANZ.PET X1L,3675.0,VINAGRE /ACETO / JUGO DE LIMON
851,103776,VARIOS,MENOYO ACETO BALSAMICO BOTX250,1779.0,VINAGRE /ACETO / JUGO DE LIMON
466,101345,EL ABASTECEDOR,MENOYO VINAGRE ALCOHOL PET X 1L,1039.0,VINAGRE /ACETO / JUGO DE LIMON
465,101344,PRECIOS JUSTOS,MENOYO VINAGRE ALCOHOL PET.X500CC,719.0,VINAGRE /ACETO / JUGO DE LIMON
468,101347,VIUDA DE MENOYO E HI,MENOYO VINAGRE MANZANA PET.X 1L,2169.0,VINAGRE /ACETO / JUGO DE LIMON
467,101346,VIUDA DE MENOYO E HI,MENOYO VINAGRE MANZANA PETX500CC,1359.0,VINAGRE /ACETO / JUGO DE LIMON
470,101349,VIUDA DE MENOYO E HI,MENOYO VINAGRE VINO PET.X 1L,1789.0,VINAGRE /ACETO / JUGO DE LIMON
469,101348,VIUDA DE MENOYO E HI,MENOYO VINAGRE VINO PET.X500CC,1090.0,VINAGRE /ACETO / JUGO DE LIMON
527,101536,EL ABASTECEDOR,MINERVA JUGO/LIMON PET X500G,965.0,VINAGRE /ACETO / JUGO DE LIMON
3816,113392,LA CACHUERA S.A.,AMANDA YERBA MATE TRAD. X1KG,3219.0,YERBAS
2020,113284,LA CACHUERA S.A.,AMANDA YERBA MATE TRAD.X500GR,1495.0,YERBAS
7090,101350,LA CACHUERA S.A.,AMANDA YERBA PREMIUM X500G,2185.0,YERBAS
471,101353,CACHAY S.A,CACHAMATE YERBA AMARILLAX500G,1330.0,YERBAS
741,102907,CACHAY S.A,CACHAMATE YERBA ROSA X500G,1330.0,YERBAS
1626,111525,CACHAY S.A,CACHAMATE YERBA SERRANA X500G,1330.0,YERBAS
4382,106241,ESTABLECIMIENTO SANT,CBSE MAS YERBA NARANJA X500G,1745.0,YERBAS
1143,108055,ESTABLECIMIENTO SANT,CBSE YERBA GUARANA X500G,1745.0,YERBAS
472,101354,ESTABLECIMIENTO SANT,CBSE YERBA HIERBAS SERR.X500G,1745.0,YERBAS
4551,106338,ESTABLECIMIENTO SANT,CBSE YERBA POMELO X500G,1745.0,YERBAS
4552,107808,ESTABLECIMIENTO SANT,CBSE YERBA SILUE.NARANJA X500G,1745.0,YERBAS
9668,101360,MOLINOS RIO DE LA PL,CRUZ MALTA YERBA X1KG,3215.0,YERBAS
9676,101358,MOLINOS RIO DE LA PL,CRUZ MALTA YERBA X500G,1699.0,YERBAS
1398,110094,ES.LAS MARIAS SACIFA,LA MERCED BARBACUA YERBA X500G,2953.0,YERBAS
1399,110095,ES.LAS MARIAS SACIFA,LA MERCED CPO.MONTE YERBA X500G,2953.0,YERBAS
474,101367,ES.LAS MARIAS SACIFA,LA MERCED D.CAMPO YERBA X500G,2953.0,YERBAS
1397,110093,ES.LAS MARIAS SACIFA,LA MERCED D.MONTE YERBA X500G,2953.0,YERBAS
7401,105806,EL ABASTECEDOR,N.GAUCHA YERBA SELECCION X500G,1445.0,YERBAS
478,101382,HREÑUK S.A.,ROSAMONTE YERBA ESPECIAL X500G,2345.0,YERBAS
15129,113001,HREÑUK S.A.,ROSAMONTE YERBA SUAVE .X500G,1735.0,YERBAS
1797,112277,HREÑUK S.A.,ROSAMONTE YERBA SUAVE X1KG,3270.0,YERBAS
480,101385,PRECIOS JUSTOS,ROSAMONTE YERBA X1KG,3019.0,YERBAS
479,101384,PRECIOS JUSTOS,ROSAMONTE YERBA X500G,1640.0,YERBAS
476,101370,ES.LAS MARIAS SACIFA,TARAGUI YERBA S/PALO AZUL X500G,2710.0,YERBAS
1022,106162,J. LLORENTE Y CIA. S,TRANQUERA YERBA ESP.X500G,2192.0,YERBAS
6186,101399,VARIOS,UNION 4FLEX YERBA MATE X1KG,3469.0,YERBAS
884,104053,MOLINOS RIO DE LA PL,GRANJA DEL SOL ARVEJAS X300GRS,1565.0,VEGETALES CONGELADOS
1109,107442,EL ABASTECEDOR,GRANJA DEL SOL BROCOLI X400GRS,1955.0,VEGETALES CONGELADOS
653,102147,MOLINOS RIO DE LA PL,GRANJA DEL SOL CHOCLO DESGR.X300GRS,1415.0,VEGETALES CONGELADOS
654,102148,EL ABASTECEDOR,GRANJA DEL SOL ESPINACA X500GRS,1520.0,VEGETALES CONGELADOS
11832,104242,MOLINOS RIO DE LA PL,GRANJA DEL SOL MIX PRIMAVERA X 400G,1689.0,VEGETALES CONGELADOS
9474,112507,QUICKFOOD S.A.,GREEN LIFE CHAUCHA CONG. X300G,1563.0,VEGETALES CONGELADOS
9475,112592,QUICKFOOD S.A.,GREEN LIFE CHOCLO CONG. X300G,1534.0,VEGETALES CONGELADOS
1264,109229,JBS ARGENTINA  S.A.,MC CAIN PAPAS FRITAS TRADX400G,1627.0,PAPAS CONGELADAS
901,104230,INVENTARIABLES,MC CAIN PAPAS NOISETTES X500G,2605.0,PAPAS CONGELADAS
1019,106119,JBS ARGENTINA  S.A.,MC CAIN PAPAS SMILES X600G,3384.0,PAPAS CONGELADAS
9783,69000,EL ABASTECEDOR,EL ABAST HAMB.100%NOVILLO 12UX950G,6799.0,HAMBURGUESAS Y MEDALLONES
9784,94000,EL ABASTECEDOR,EL ABAST.HAMB.100% NOVILLO 4UX320G,2449.0,HAMBURGUESAS Y MEDALLONES
685,102392,INVENTARIABLES,PATY HAMBURGUESA CONG.X12U,8818.0,HAMBURGUESAS Y MEDALLONES
787,103303,VARIOS,SWIFT MEDALLON CARNE X4 X69 GR,2217.0,HAMBURGUESAS Y MEDALLONES
788,103304,VARIOS,SWIFT MEDALLON DOBLE X2 X112 GRS,880.0,HAMBURGUESAS Y MEDALLONES
1805,112290,MOLINOS RIO DE LA PL,GRANJA DEL SOL FILET MERLUZA REB.X500G,7940.0,PESCADOS Y MARISCOS
1391,110041,EL ABASTECEDOR,GRANJA DEL SOL MILANESA DE SOJA C/ESPIN.X330G.,1789.0,REBOZADOS CONGELADOS
348,104732,VARIOS,GRANJA DEL SOL MILANESA DE SOJA X 330G,1739.0,REBOZADOS CONGELADOS
1349,109803,EL ABASTECEDOR,GRANJA DEL SOL MILANESA SOJA CALX330GS,1789.0,REBOZADOS CONGELADOS
692,102443,INVENTARIABLES,GRANJA DEL SOL PATITAS X400 GRS,4048.0,REBOZADOS CONGELADOS
315,100700,MOLINOS RIO DE LA PL,GRANJA DEL SOL SUPREMA POLLO CLAS.X360GRS,4312.0,REBOZADOS CONGELADOS
314,100698,INVENTARIABLES,GRANJA DEL SOL SUPREMA POLLO ESP/QU.X400,4340.0,REBOZADOS CONGELADOS
2102,113599,VARIOS,SWIFT BOCADITOS DE POLLO X380GR,2257.0,REBOZADOS CONGELADOS
1332,109640,INVENTARIABLES,VEGETALEX MILANESA SOJA C/CEB.X4,1990.0,REBOZADOS CONGELADOS
1331,109639,PROTEINAS ARGENTINAS,VEGETALEX MILANESA SOJA C/ESPINACA X4,1990.0,REBOZADOS CONGELADOS
1333,109641,INVENTARIABLES,VEGETALEX MILANESA SOJA TRADIC.X4,1800.0,REBOZADOS CONGELADOS
1236,109109,INVENTARIABLES,LA SERE CREMA D LECHE CARTON X520CC,3145.0,CREMA DE LECHE
1513,110900,INVENTARIABLES,LA SERE CREMA D LECHE SLIM CART X200CC,1339.0,CREMA DE LECHE
4660,18600,INVENTARIABLES,TREGAR CREMA DE LECHE X200CC,1350.0,CREMA DE LECHE
8872,18600,INVENTARIABLES,TREGAR CREMA DE LECHE X200CC,1350.0,CREMA DE LECHE
1457,110440,MASTELLONE HNOS. S.A,LA SERE DULCE D LECHE COLONIAL X1K,4645.0,DULCE DE LECHE
2034,113339,MASTELLONE HNOS. S.A,LA SERE DULCE D LECHE COLONIAL X250G,1325.0,DULCE DE LECHE
4570,111516,MASTELLONE HNOS. S.A,ARMONIA LECHE ENT.SACH X1LT,839.0,LECHES
1472,110533,INVENTARIABLES,LA SERE LECHE PVO DESC BOLS X200G,1745.0,LECHES
1471,110532,INVENTARIABLES,LA SERE LECHE PVO ENT BOLS X200G,1895.0,LECHES
1458,110441,EL ABASTECEDOR,LA SERE LECHE PVO ENT EST X400G,3745.0,LECHES
919,104450,INVENTARIABLES,LA SERE MANTECA X100G,1343.37,MANTECAS
8752,102401,INVENTARIABLES,DANICA MARG.SOFT LIGHT POTE X200GR,1245.0,MARGARINA
689,102402,INVENTARIABLES,DANICA MARGARINA PAN X200GR,1150.0,MARGARINA
782,103288,INVENTARIABLES,SERENITO POS.C/CONF.VAI.X120GRS,1931.0,POSTRES
780,103283,INVENTARIABLES,SERENITO POS.VAINILLA X120GR,1606.0,POSTRES
5098,110930,INVENTARIABLES,SERENITO POST.CHOC. X 95GR,800.0,POSTRES
5099,112212,DANONE ARGENTINA S.A,SERENITO POST.WAU D.LECH.X100G,800.0,POSTRES
5100,112213,INVENTARIABLES,SERENITO POSTRE VAI.X 95G,800.0,POSTRES
1284,109301,BENESSERE,DAHI YOGUR BAT.DESC. C/FRUTILLAX200G,1240.0,YOGUR
7612,109303,BENESSERE,DAHI YOGUR BAT.DESC.C/CIRUELA,1240.0,YOGUR
6966,109304,BENESSERE,DAHI YOGUR BAT.DESC.C/DURAZNOX200G,1240.0,YOGUR
1285,109302,BENESSERE,DAHI YOGUR BAT.DESC.C/FRUT.BOSQUEX200G,1240.0,YOGUR
8241,109299,BENESSERE,DAHI YOGUR BAT.ENT.C/CIRUELA X200G,1240.0,YOGUR
6965,109300,BENESSERE,DAHI YOGUR BAT.ENT.C/DURAZNOX200G,1240.0,YOGUR
1283,109298,BENESSERE,DAHI YOGUR BAT.ENT.C/FRUT.BOSQUEX200G,1240.0,YOGUR
1282,109297,BENESSERE,DAHI YOGUR BAT.ENT.C/FRUTILLA X200G,1240.0,YOGUR
1818,112335,BENESSERE,DAHI YOGUR BAT.ENT.MGO/MAR.200G,1240.0,YOGUR
6998,112517,BENESSERE,DAHI YOGUR DESC. NATURAL X200G,1035.0,YOGUR
1281,109296,BENESSERE,DAHI YOGUR FIRME DESC.FRUTILLA X200G,1035.0,YOGUR
1280,109295,BENESSERE,DAHI YOGUR FIRME DESC.VAINILLAX200G,1035.0,YOGUR
1279,109294,BENESSERE,DAHI YOGUR FIRME ENTERO FRUTILLAX200G,1035.0,YOGUR
1278,109293,BENESSERE,DAHI YOGUR FIRME ENTERO VAINILLAX200G,1035.0,YOGUR
6964,109291,BENESSERE,DAHI YOGUR NATURAL S/AZUC.X200GR,1035.0,YOGUR
1064,106599,INVENTARIABLES,DANONINO YOG.BEB.FRUT. X185GR,1635.0,YOGUR
1463,110472,DANONE ARGENTINA S.A,SER YOG.BEBIBLE MULTIFRUTA X185GR,1595.0,YOGUR
3553,111334,INVENTARIABLES,SER YOG.C/CER.CORN FLAKES X166GR,1774.0,YOGUR
4582,107409,DANONE ARGENTINA S.A,YOGURI.FORTIFICADO FRUTILLA X1KG,1900.0,YOGUR
1820,112349,INVENTARIABLES,NUTRILON LE.INFANTIL 1 T/B X200ML,1778.0,LACTEOS BEBE
1886,112673,INVENTARIABLES,NUTRILON LE.INFANTIL 2 T/B X200ML,1679.0,LACTEOS BEBE
1897,112707,INVENTARIABLES,NUTRILON LE.INFANTIL 3 T/B X200ML,1673.0,LACTEOS BEBE
5421,110470,INVENTARIABLES,SERE.BABY 2 LECHE T/B X200ML,1020.0,LACTEOS BEBE
5422,110498,INVENTARIABLES,SERE.BABY 3 LECHE T/B X200ML,998.0,LACTEOS BEBE
3843,110894,NUTRICIA BAGO S.A.,VITAL LECHE INFANTIL 1 T/B X200ML,1209.0,LACTEOS BEBE
3886,110897,NUTRICIA BAGO S.A.,VITAL LECHE INFANTIL 3 T/B X200ML,1358.0,LACTEOS BEBE
1298,109400,INVENTARIABLES,GRANJA IRIS SALCH X6U,1625.0,SALCHICHAS
1299,109401,INVENTARIABLES,GRANJA IRIS SALCHICHAS X10 + 2U,2950.0,SALCHICHAS
1188,108454,INVENTARIABLES,PATYVIENA SALCHICHAS X6U,1144.0,SALCHICHAS
843,103732,INVENTARIABLES,PATYVIENA SALCHICHASX 12UNID,2168.0,SALCHICHAS
9306,102451,INVENTARIABLES,VIENISSIMA SALCHICHAS X12U,2124.0,SALCHICHAS
5095,102452,INVENTARIABLES,VIENISSIMA SALCHICHAS X6U,1050.0,SALCHICHAS
1259,109219,INVENTARIABLES,LA SALTEÑA TAPAS EMP.P/FREIR X15U,1420.0,EMPANADAS TAPAS
9080,109221,INVENTARIABLES,LA SALTEÑA TAPAS HOJALDR.P/H X12U,1420.0,EMPANADAS TAPAS
1258,109218,MOLINOS RIO DE LA PL,LA SALTEÑA TAPAS LIGHT X 12 UNI,1410.0,EMPANADAS TAPAS
687,102395,EL ABASTECEDOR,CALSA LEVADURA X 50GR.,299.0,LEVADURAS
1256,109214,EL ABASTECEDOR,LA SALTEÑA PASCUALINA CRIOLLA X400G,1395.0,PASCUALINAS TAPAS
1300,109419,EL ABASTECEDOR,LA SALTEÑA PASCUALINA LIGHT X400G,1399.0,PASCUALINAS TAPAS
8859,109116,INVENTARIABLES,LA SALTEÑA RAVIOLES CARNE Y ESPINACA X 450G,2150.0,PASTAS FRESCAS
1238,109113,MOLINOS RIO DE LA PL,LA SALTEÑA RAVIOLES ESPI/MUZ/.X450G,2150.0,PASTAS FRESCAS
3970,109115,EL ABASTECEDOR,LA SALTEÑA RAVIOLES RICOTA X450G,2150.0,PASTAS FRESCAS
1560,111109,MOLINOS RIO DE LA PL,LA SALTEÑA SORRENTINO JAM/MUZ X300G,2020.0,PASTAS FRESCAS
246,11752,INVENTARIABLES,ORALI RAVIOLES RICOTTA X454G,1429.0,PASTAS FRESCAS
5405,102413,MILKAUT S.A.,ADLER QUESO UNTABLE JAMON X100G,1281.0,QUESOS UNTABLES
5406,102415,MILKAUT S.A.,ADLER QUESO UNTABLE SALAME X100G,1281.0,QUESOS UNTABLES
